[
  {
    "src": "function:cgm.callgraph.CallGraphExtractor.extract_calls",
    "dst": "function:cgm.callgraph.CallVisitor",
    "type": "call_intra",
    "meta": {}
  },
  {
    "src": "function:cgm.callgraph.CallGraphExtractor.extract_calls",
    "dst": "function:cgm.callgraph.visit",
    "type": "call_intra",
    "meta": {}
  },
  {
    "src": "function:cgm.callgraph.CallVisitor.visit_Call",
    "dst": "function:cgm.callgraph.append",
    "type": "call_intra",
    "meta": {}
  },
  {
    "src": "function:cgm.callgraph.CallVisitor.visit_Call",
    "dst": "function:cgm.callgraph.generic_visit",
    "type": "call_intra",
    "meta": {}
  },
  {
    "src": "function:cgm.callgraph.CallVisitor.visit_Call",
    "dst": "function:cgm.callgraph.isinstance",
    "type": "call_intra",
    "meta": {}
  },
  {
    "src": "function:cgm.callgraph.CallVisitor.visit_Call",
    "dst": "function:cgm.callgraph.isinstance",
    "type": "call_intra",
    "meta": {}
  },
  {
    "src": "function:cgm.callgraph.CallVisitor.visit_Call",
    "dst": "function:cgm.callgraph.isinstance",
    "type": "call_intra",
    "meta": {}
  },
  {
    "src": "function:cgm.callgraph.CallVisitor.visit_Call",
    "dst": "function:cgm.callgraph.isinstance",
    "type": "call_intra",
    "meta": {}
  },
  {
    "src": "function:cgm.callgraph.CallVisitor.visit_ClassDef",
    "dst": "function:cgm.callgraph.append",
    "type": "call_intra",
    "meta": {}
  },
  {
    "src": "function:cgm.callgraph.CallVisitor.visit_ClassDef",
    "dst": "function:cgm.callgraph.generic_visit",
    "type": "call_intra",
    "meta": {}
  },
  {
    "src": "function:cgm.callgraph.CallVisitor.visit_ClassDef",
    "dst": "function:cgm.callgraph.isinstance",
    "type": "call_intra",
    "meta": {}
  },
  {
    "src": "function:cgm.callgraph.CallVisitor.visit_ClassDef",
    "dst": "function:cgm.callgraph.pop",
    "type": "call_intra",
    "meta": {}
  },
  {
    "src": "function:cgm.callgraph.CallVisitor.visit_FunctionDef",
    "dst": "function:cgm.callgraph.append",
    "type": "call_intra",
    "meta": {}
  },
  {
    "src": "function:cgm.callgraph.CallVisitor.visit_FunctionDef",
    "dst": "function:cgm.callgraph.generic_visit",
    "type": "call_intra",
    "meta": {}
  },
  {
    "src": "function:cgm.callgraph.CallVisitor.visit_FunctionDef",
    "dst": "function:cgm.callgraph.pop",
    "type": "call_intra",
    "meta": {}
  },
  {
    "src": "function:cgm.cli.main",
    "dst": "function:cgm.cli.ArgumentParser",
    "type": "call_intra",
    "meta": {}
  },
  {
    "src": "function:cgm.cli.main",
    "dst": "function:cgm.cli.CGMParams",
    "type": "call_intra",
    "meta": {}
  },
  {
    "src": "function:cgm.cli.main",
    "dst": "function:cgm.cli.add_argument",
    "type": "call_intra",
    "meta": {}
  },
  {
    "src": "function:cgm.cli.main",
    "dst": "function:cgm.cli.add_argument",
    "type": "call_intra",
    "meta": {}
  },
  {
    "src": "function:cgm.cli.main",
    "dst": "function:cgm.cli.add_argument",
    "type": "call_intra",
    "meta": {}
  },
  {
    "src": "function:cgm.cli.main",
    "dst": "function:cgm.cli.add_argument",
    "type": "call_intra",
    "meta": {}
  },
  {
    "src": "function:cgm.cli.main",
    "dst": "function:cgm.cli.add_argument",
    "type": "call_intra",
    "meta": {}
  },
  {
    "src": "function:cgm.cli.main",
    "dst": "function:cgm.cli.add_argument",
    "type": "call_intra",
    "meta": {}
  },
  {
    "src": "function:cgm.cli.main",
    "dst": "function:cgm.cli.add_argument",
    "type": "call_intra",
    "meta": {}
  },
  {
    "src": "function:cgm.cli.main",
    "dst": "function:cgm.cli.add_argument",
    "type": "call_intra",
    "meta": {}
  },
  {
    "src": "function:cgm.cli.main",
    "dst": "function:cgm.cli.add_argument",
    "type": "call_intra",
    "meta": {}
  },
  {
    "src": "function:cgm.cli.main",
    "dst": "function:cgm.cli.add_argument",
    "type": "call_intra",
    "meta": {}
  },
  {
    "src": "function:cgm.cli.main",
    "dst": "function:cgm.cli.add_argument",
    "type": "call_intra",
    "meta": {}
  },
  {
    "src": "function:cgm.cli.main",
    "dst": "function:cgm.cli.exit",
    "type": "call_intra",
    "meta": {}
  },
  {
    "src": "function:cgm.cli.main",
    "dst": "function:cgm.cli.items",
    "type": "call_intra",
    "meta": {}
  },
  {
    "src": "function:cgm.cli.main",
    "dst": "function:cgm.cli.len",
    "type": "call_intra",
    "meta": {}
  },
  {
    "src": "function:cgm.cli.main",
    "dst": "function:cgm.cli.parse_args",
    "type": "call_intra",
    "meta": {}
  },
  {
    "src": "function:cgm.cli.main",
    "dst": "function:cgm.cli.print",
    "type": "call_intra",
    "meta": {}
  },
  {
    "src": "function:cgm.cli.main",
    "dst": "function:cgm.cli.print",
    "type": "call_intra",
    "meta": {}
  },
  {
    "src": "function:cgm.cli.main",
    "dst": "function:cgm.cli.print",
    "type": "call_intra",
    "meta": {}
  },
  {
    "src": "function:cgm.cli.main",
    "dst": "function:cgm.cli.print",
    "type": "call_intra",
    "meta": {}
  },
  {
    "src": "function:cgm.cli.main",
    "dst": "function:cgm.cli.print",
    "type": "call_intra",
    "meta": {}
  },
  {
    "src": "function:cgm.cli.main",
    "dst": "function:cgm.cli.print",
    "type": "call_intra",
    "meta": {}
  },
  {
    "src": "function:cgm.cli.main",
    "dst": "function:cgm.cli.print",
    "type": "call_intra",
    "meta": {}
  },
  {
    "src": "function:cgm.cli.main",
    "dst": "function:cgm.cli.print",
    "type": "call_intra",
    "meta": {}
  },
  {
    "src": "function:cgm.cli.main",
    "dst": "function:cgm.cli.print",
    "type": "call_intra",
    "meta": {}
  },
  {
    "src": "function:cgm.cli.main",
    "dst": "function:cgm.cli.print",
    "type": "call_intra",
    "meta": {}
  },
  {
    "src": "function:cgm.cli.main",
    "dst": "function:cgm.cli.print",
    "type": "call_intra",
    "meta": {}
  },
  {
    "src": "function:cgm.cli.main",
    "dst": "function:cgm.cli.run_map",
    "type": "call_intra",
    "meta": {}
  },
  {
    "src": "function:cgm.emit_csv.CSVEmitter.__init__",
    "dst": "function:cgm.emit_csv.mkdir",
    "type": "call_intra",
    "meta": {}
  },
  {
    "src": "function:cgm.emit_csv.CSVEmitter._emit_import_matrix",
    "dst": "function:cgm.emit_csv.add",
    "type": "call_intra",
    "meta": {}
  },
  {
    "src": "function:cgm.emit_csv.CSVEmitter._emit_import_matrix",
    "dst": "function:cgm.emit_csv.add",
    "type": "call_intra",
    "meta": {}
  },
  {
    "src": "function:cgm.emit_csv.CSVEmitter._emit_import_matrix",
    "dst": "function:cgm.emit_csv.append",
    "type": "call_intra",
    "meta": {}
  },
  {
    "src": "function:cgm.emit_csv.CSVEmitter._emit_import_matrix",
    "dst": "function:cgm.emit_csv.defaultdict",
    "type": "call_intra",
    "meta": {}
  },
  {
    "src": "function:cgm.emit_csv.CSVEmitter._emit_import_matrix",
    "dst": "function:cgm.emit_csv.defaultdict",
    "type": "call_intra",
    "meta": {}
  },
  {
    "src": "function:cgm.emit_csv.CSVEmitter._emit_import_matrix",
    "dst": "function:cgm.emit_csv.info",
    "type": "call_intra",
    "meta": {}
  },
  {
    "src": "function:cgm.emit_csv.CSVEmitter._emit_import_matrix",
    "dst": "function:cgm.emit_csv.len",
    "type": "call_intra",
    "meta": {}
  },
  {
    "src": "function:cgm.emit_csv.CSVEmitter._emit_import_matrix",
    "dst": "function:cgm.emit_csv.open",
    "type": "call_intra",
    "meta": {}
  },
  {
    "src": "function:cgm.emit_csv.CSVEmitter._emit_import_matrix",
    "dst": "function:cgm.emit_csv.set",
    "type": "call_intra",
    "meta": {}
  },
  {
    "src": "function:cgm.emit_csv.CSVEmitter._emit_import_matrix",
    "dst": "function:cgm.emit_csv.sorted",
    "type": "call_intra",
    "meta": {}
  },
  {
    "src": "function:cgm.emit_csv.CSVEmitter._emit_import_matrix",
    "dst": "function:cgm.emit_csv.writer",
    "type": "call_intra",
    "meta": {}
  },
  {
    "src": "function:cgm.emit_csv.CSVEmitter._emit_import_matrix",
    "dst": "function:cgm.emit_csv.writerow",
    "type": "call_intra",
    "meta": {}
  },
  {
    "src": "function:cgm.emit_csv.CSVEmitter._emit_import_matrix",
    "dst": "function:cgm.emit_csv.writerow",
    "type": "call_intra",
    "meta": {}
  },
  {
    "src": "function:cgm.emit_csv.CSVEmitter.emit_all",
    "dst": "function:cgm.emit_csv._emit_import_matrix",
    "type": "call_intra",
    "meta": {}
  },
  {
    "src": "function:cgm.emit_csv.CSVEmitter.emit_all",
    "dst": "function:cgm.emit_csv.append",
    "type": "call_intra",
    "meta": {}
  },
  {
    "src": "function:cgm.emit_csv.CSVEmitter.emit_all",
    "dst": "function:cgm.emit_csv.append",
    "type": "call_intra",
    "meta": {}
  },
  {
    "src": "function:cgm.emit_csv.CSVEmitter.emit_all",
    "dst": "function:cgm.emit_csv.dumps",
    "type": "call_intra",
    "meta": {}
  },
  {
    "src": "function:cgm.emit_csv.CSVEmitter.emit_all",
    "dst": "function:cgm.emit_csv.get",
    "type": "call_intra",
    "meta": {}
  },
  {
    "src": "function:cgm.emit_csv.CSVEmitter.emit_all",
    "dst": "function:cgm.emit_csv.info",
    "type": "call_intra",
    "meta": {}
  },
  {
    "src": "function:cgm.emit_csv.CSVEmitter.emit_all",
    "dst": "function:cgm.emit_csv.len",
    "type": "call_intra",
    "meta": {}
  },
  {
    "src": "function:cgm.emit_csv.CSVEmitter.emit_all",
    "dst": "function:cgm.emit_csv.open",
    "type": "call_intra",
    "meta": {}
  },
  {
    "src": "function:cgm.emit_csv.CSVEmitter.emit_all",
    "dst": "function:cgm.emit_csv.sorted",
    "type": "call_intra",
    "meta": {}
  },
  {
    "src": "function:cgm.emit_csv.CSVEmitter.emit_all",
    "dst": "function:cgm.emit_csv.writer",
    "type": "call_intra",
    "meta": {}
  },
  {
    "src": "function:cgm.emit_csv.CSVEmitter.emit_all",
    "dst": "function:cgm.emit_csv.writerow",
    "type": "call_intra",
    "meta": {}
  },
  {
    "src": "function:cgm.emit_csv.CSVEmitter.emit_all",